title,label
EMR 최우수영업사원 에 대형SUV차량 포상,1
코닥어패럴 화보 장인 정해인 B컷 공개,0
주당 5원 현금배당,1
지난해 영업이익 17억원 전년 대비 1072%↑,1
지난해 영업익 17억 전년비 1072 3% ↑,1
작년 연간 영업익 16억 전년 동기 1억,0
3Q 영업이익 4억 흑자전환,1
주가 5%↑ 2Q 영업익 9억 흑자 전환,1
오후 갑작스런 8% 급등 공매도 수량 22주로 줄어들어,1
특징주 4% 상승 LG그룹 관련주,1
가파른 상승세로 5% 상승 공매도 수량 32주로 줄어들어,1
창원시 소부장 뿌리기술 선도기업 육성 22일까지 모집,1
공군 대전일자리경제진흥원 장병 창업지원 맞손,1
창원시 소재 부품 장비 뿌리기술 전문기업 집중 육성,0
경상북도 제품 디자인 브랜드 개발 지원 참여 중소기업 모집,1
울산시 신기술 창업 활성화 민간지원사업 참여기업 모집,1
전라북도 농생명 바이오 식품 기업지원시책 총람 자료발간 배포,1
김해형 강소기업 육성 참여기업 모집,0
㈜ 공동모금회에 성금 기탁,0
주 산불피해 지원성금 200만원 기탁,-1
경북도 중소기업 온라인몰 상세페이지 디자인 지원 사업 추진,1
반발성 매수세 점증 거래소동시호가,0
업종전반 매수세 양호 거래소동시호가,1
업앤다운 건설주 상승 HDC현대산업개발 ↑ B ↓,-1
진흥기업우B 2우B 시간외 상한가 재공시는 아직인데 매각설,-1
특징주 진흥기업 진흥기업우B B 9% 상승 안성 공동주택 계약,1
3일 특징주 에이디엠코리아 따상 성공 B 쎄미시스코 등 8개,1
급등락주 짚어보기 B 매각설 풍문 영향 상한가,-1
갭상승 TOP5 진흥기업우B B 진흥기업 대유플러스 모두투어리,1
시간외 증시 진흥기업우B B 진흥기업 신영스팩6호 시간외 상,0
이격도과열 상승 TOP5 진흥기업우B B 진흥기업 마이크로컨텍,1
아모레 LG생건 더마 경쟁력 강화에 집중 영토확장 속도전,1
서경배 회장 지난해 보수 44억원,0
디지털 강화한 라이프뷰티 기업 도약,1
아모레퍼시픽 매칭 기프트 135곳에 1억5천만원 기부,0
아모레퍼시픽미술관 안드레아스 거스키 신작 세계 최초 공개,1
중국시장 먹구름인데 배당 정책 뒷말 까닭,1
동해안 산불 성금 2억원 기부,0
강원 경북 산불피해 복구에 2억원 기부,-1
서경배 회장 지난해 보수 44억 원,0
아모레퍼시픽 ESG 거버넌스체계 강화 5가지 실천목표 제시,1
주당 550원 현금배당 결정,1
지난해 영업익 240억 전년비 7 2% ↑,1
주가 기술적 반등이후 저지선 지켜낼까 외국인과 기관 매도우위,1
실적점검 3Q 영업이익 48억원 PER 7 6배,1
2분기 영업익 68억 원 전년比 40 8%↑,1
스몰캡 자동차 사업부 편입하며 실적 성장,1
3세 요람 승계론,0
배당 늘리는 주가도 함박 웃을까,1
인천중부소방서 인천안전누리상 표창장 전수,0
올 상반기 매출 2242억 달성 전년 동기比 5 7%↑,1
올 1분기 영업익 18억 달성 흑자전환,1
선창산업 로 사명 바꿔 국내외 계열사도 적용,0
더벨 건자재 전문 천안 성거산업단지 개발 돌입,1
인천 부평구 ㈜ 과 공원 녹지 임목처리 협약 체결,1
부평 공원 녹지 임목처리 협약 체결,1
부평구 ㈜ 과 공원 녹지 임목처리 협약 체결,1
천안 성거산업단지 조성 사업 착공,1
청정국가 뉴질랜드 이젠 ESG가 대세,0
자기주식 2만5000주 취득 결정,1
주당 500원 현금배당 결정,1
작년 연간 연결 영업익 571억 전년비 33 3%↑,1
경남대 김세윤 교수 신진과학자상 수상,1
경남대 김세윤 교수 신진과학자상 수상,1
특징주 한창제지 포장 수혜주 현재 주가 시황은,1
주가 16%↑ 확진자 연일 5만명대에 포장재 관련주 강세,1
주당 60원 결산배당 결정,1
영풍제지 골판지 관련주 급등에 하락으로 엇갈려 특히 영풍제지,-1
강세주 10% 상승 사회적 거리두기 수혜,1
포장 골판지 관련주 영풍제지 주가 급등 이유,1
영풍제지 골판지 관련주 모두 급등 영풍제지 25% 급등 이어 신풍,1
포장 관련주 대영포장 주가 상승세 배경은,1
대유위니아 성장의 이면,1
특징주 숨은 알루미늄 관련주 거래량 천만 목전 주가는,0
실적점검 21 4Q 영업이익 176억원 전년비 28 1%,1
대유위니아그룹 종합R&D센터 준공 완료,0
대유위니아그룹 일부 직원들 경기도 성남 R&D센터로 출근처 바뀌며 현타온다,0
현대트랜시스 차량용의자 완제품 공급업체 선정,1
자동차부품업계 전년 연간실적으로 희비 엇갈려 전년 순이익 72,1
대유위니아그룹 종합R&D센터 준공 완료,0
현대경영 특집판 The 7 Habits,0
동반위 TYM 과 중소 협력기업 ESG 지원,1
마켓인사이트 농기계 전문 업체 해외 매출 증가하면서 신용도 전망,1
15일 공시 자사주매입 종근당홀딩스,0
TYM 고객케어센터 CCC 오픈 원스톱 고객 서비스 강화,1
TYM 우크라이나에 트랙터 현금 기부,0
농기계 기업 TYM 트랙터 디자인 공모전 개최,0
지난해 영업익 75억 흑자전환,1
주당 120원 현금배당 결정,1
장 중 기업공시 3월 8일,0
기업공시 3월 8일 금호석유 1500억 규모 자사주 취득 등,1
주가 상한가 무슨 이슈 있나,1
고의로 조합원 연월차수당 미지급한 회장 벌금형,0
수억대 수당 지급안한 회장 2심도 벌금 2천만원,0
류홍우 명예회장 별세 자동차 부품산업 선구자,0
낮에 급등했다가 이내 상승폭 줄어들어 롤러코스터 주가,1
에디슨EV 태림포장 시간외 주가 상한가,1
S Oil 고배당 한국 소비자 돈으로 해외 대주주 배만 불리나,1
석유가스 상장기업 대성산업 전년 연간매출액 영업익↑,1
작년 연간 영업익 380억 전년비 22 8%↑,1
영업익 380억 전년비 22 8%↑,1
주당 1만9000원 현금배당 결정,1
SK이노베이션 석유가스 상장기업 브랜드평판 3월 1위,0
예룬 라머스 신임 대표이사 선임,0
오지원 대표 사임 라머스 예룬 피터 대표 선임,1
실적점검 3Q 영업이익 93억원 PER 14 5배,1
제주ICC호텔 손실 털고 재무구조 개선 가속화,1
경제개혁연대 전 현직 이사들 상대 주주대표소송,-1
배당 확대 금호고속 가뭄 속 단비,1
화성 광주 고속도로 개통 연간 960억원 물류비 절감,0
박삼구 복심 서재환 대표 비판여론에도 재선임 성공,1
1분기 영업이익 272억원 주택 중심으로 안정적 이익 성장,1
신재생에너지 바이오가스 상용화 성공,1
CGCG 서재환 후보 재선임 반대 경영진 불법행위 감독 소홀,-1
계룡건설 컨소시엄 리더스시티 5블록 4월 분양,0
건설 부동산 1장 동부건설 삼성물산 외,0
전립선암 치료제 임상 1상서 유의성 확인,1
정길영 전 감사위원 사외이사로 靑행정관은 쿠팡 취업,0
이BIO 유한양행 제일파마홀딩스 외,0
전립선암 치료제 개량신약 1상 긍정적,0
美 투자사 ACER 801 FDA 임상2상 첫 환자등록,1
성과내기 쉽지 않네 경영 손 떼는 제약 오너가 家 들,1
이우현 OCI 부회장 각자 대표로,0
특징주 약발 떨어지나 현재 주가 살펴보니,0
OCI와 공동 경영 이우현 부회장 신규 선임,0
제약 바이오 업계에 부는 새판짜기 바람,0
자회사 자원 파산 신청,0
스타일크루 메가 유튜버 과 유니크한 콜라보 진행,0
주가 6%↑ 급상승 이유는,1
강세주 8% 상승 이틀 연속 상승,1
주당 130원 현금배당 결정,1
주가 6%↑ 삼강엠앤티와 581억 규모 공급계약 체결,1
주 삼강엠앤티 주 와 총 581억원 규모 해경경비함 엔진 감속기 공급계,1
세아베스틸지주 내달 탄생 형제경영 시스템 고도화,0
역대급 호실적 세아제강 통 큰 배당 화답,1
중후장대산업 오너 3세 경영 전면 그룹 체질 바꾼다,0
세아그룹 배터리 해상풍력 등 특수강 개발 속도 미래 먹거리 발굴,1
자회사 세아씨엠 주당 3500원 현금배당,1
3월 22일 주주총회 개최,0
지난해 영업익 2989억 전년비 345%↑,1
주당 4050원 배당 우크라 사태로 강관 수출↑,1
세아스틸인터 주당 4050원 현금배당,1
굴리고 모은 코로나 2년 제약업계 수익 흐름은 좋았다,1
지난해 제약 주머니 속 실탄 더 줄었다,-1
지난해 매출 565억 전년비 5 9%↑,1
제약업계 주총 슈퍼위크 오너 3세 경영권 승계 주목,1
에이프로젠MED 모두 보합세 특히 4거래일,0
25개 상위제약사 1000억원 이상 부채 신약개발 빚낸다,-1
한독 보령제약 대원제약 삼일제약 동화약품 오너 3세 경영권 승계 주목,1
24시간이 모자라 제약사들 감기약 대란에 철야 주말 특근 풀가동,0
지난해 제약 씀씀이는 큰데 알차게는 못썼다,0
삼성물산 현대엔지니어링 등 건설업계 경력 채용,0
김정일 대표이사 신규 선임,0
노량진3구역 포스코건설과 수주전,1
들러리 논란 서울 공략 공들인다 노량진3구역 총력전 선언,-1
삼성물산 현대엔지니어링 동부건설 채용,0
시공 송도 하늘채 아이비스퀘어 분양 나서,0
PC 대안 공법 KG합성보시스템 개발,1
직방 아워홈 원격근무 업무협약 外 쿡경제,1
노원구→노량진으로 서울 정비사업 노크,0
코오롱 차세대 수소전기차 핵심부품 수분제어장치 세계 시장 1위,0
주당 120원 현금 결산 배당,1
태양금속 네온테크 시간외 거래 강세,1
주가 상한가 무슨 이슈 있나,1
서울 안성지역 시설에 어린이 북트리 도서 전달,0
서울 안성지역 아동 위해 북트리 및 도서 나눔,0
복지시설 등 아동 위해 북트리 도서 나눔,0
작년 연간 연결 영업익 10억 흑자전환,1
사랑과선행 주식 7만주 취득 결정,1
주가 2 75% 상승중,1
제약 당뇨병 신약 이나보글리플로진 품목허가 신청,0
메디톡스 제약 이어 휴젤도 美 ITC 제소,0
메디톡스 이번엔 휴젤 균주 도용 美 소송,-1
제약 당뇨병 신약 이나보글리플로진 국내 품목허가 신청,0
윤재춘 대표이사 재선임,0
제약 주주총회 신사업 미래 성장 노력,1
제약 당뇨병 신약 이나보글리플로진 국내 품목허가 신청,0
제약 당뇨병 치료제 식약처 품목허가 신청,0
이어 美 소송전 넓히는 메디톡스 휴젤 강력한 법적 책임 물을 것 경,-1
제약 위식도역류 신약 필리핀 인니 태국 허가 신청,0
산도스 과 산도스 슈가마덱스 단독 판매 파트너십 체결,1
적자에도 배당정책 지속 주주들은 시큰둥 왜,-1
2021년 매출 421억 전년비 3 7%↑,1
25개 상위제약사 1000억원 이상 부채 신약개발 빚낸다,-1
특허 만료 앞둔 브리디온주 제네릭 출격 대기,0
1주당 750원 현금배당 결정,1
조정 거치며 본격 상승랠리 외국인과 기관 적극 매수 움직임은,1
영업이익 이어 순이익도 적자行 재무악화 거듭,-1
씨엔티테크 육성 투자 스타트업 단신 원스글로벌 에이치비스미스,1
삼성전자와 반도체 검사장비 14억 공급 계약,1
삼성전자와 96억 규모 반도체 검사장비 공급계약,1
솔루션 산업용 비파괴검사 솔루션 제공,0
덕인 솔루션 산업용 엑스레이 솔루션 센터 개관,0
디지털 헬스케어 원스글로벌 한국벤처투자로부터 투자 유치,1
공시 22억 규모 반도체 검사장비 공급계약,1
작년 연간 연결 영업익 164억 전년비 198 4%↑,1
주당 200원 현금 배당 결정,1
전남 노조 공장 이전 막는 요양병원 퇴거 촉구,0
광주 복합쇼핑몰 유치 현실화 소상공인 상생 방안 필요해,0
광주 입점 대형 복합쇼핑몰 후보지 어디가 좋을까,0
보통주 1주당 3000원 배당 내달 24일 정기주총,1
974억 규모 시설증설 투자 결정,1
작년 연간 연결 영업익 609억 전년비 350%↑,1
윤석열 공약 광주 쇼핑몰 공약 수혜주 전방 주가↑,1
수급과 가치 52주 최고가 기록 기관 매수,1
작년 당기순익 643억 전년比 516% 증가,1
온라인에서 예술이 된 전남방직과,0
감기약 품절대란 엔데믹 수혜 제약주가 뜬다,1
정맥순환제 뉴베인액 신규 광고 공개,0
제약업계 주총서 오너 3 4세 경영 참여 본격화,0
확진자 급증에 감기약 품귀 5월까지 수급계획 수립,1
김강립 식약처장 방문 감기약 생산 현황 점검,0
새 경영진 맞이한 제약업계 변화 바람 분다,0
성과내기 쉽지 않네 경영 손 떼는 제약 오너가 家 들,1
최재호 부장 식약처 표창 수상,1
주가 훈풍 코로나에 감기약 수혜,1
5만 걸음당 삼양라면 1박스 임직원 대상 걸음 기부 캠페인,0
워크 투게더 캠페인 진행,0
유통 단신 이랜드그룹 교원그룹,0
불닭볶음면 매운맛 통했다 날개단 주가,0
특징주 불닭 시리즈 내수 해외 정복 소식에 강세 이어져,1
더벨 불닭면 달고 수출기업 변신 고용 700명 늘었다,1
불닭브랜드 신제품 2종 출시,1
식품업계 여성 CEO 시대 올해 주목받는 리더는,1
라이센스 식음료 PICK SPC 배스킨라빈스 남양유업 外,0
LG화학 울산 아크릴 합작공장 건설 탄력,0
단독 트러스톤 에 주주서한 과거 회귀 용납못해,0
LG 태광 합작 티엘케미칼 울산 화섬원료 신증설 투자,1
에스엠 에 무슨 일이 저격나선 운용사,0
주총 마친 까다로운 숙제 마주하다,0
허승조 고문 최고 보수 지급 뒷말 무성,1
코오롱 휴비스 태광 수퍼섬유 아라미드에 전력투구,0
그룹 재단 장학생 출신을 사외이사 후보 향한 우려,-1
티엘케미칼 본사 울산 유치 이어 대규모 투자,1
세계 물류대란 우려에 주가 강세 왜,-1
지난해 영업손실 19억 68% 개선,-1
특징주 해운 관련주 거래량 18배 폭등에 주가는,0
물류대란 속 해운운임 10주 연속 하락 HMM 주가도 주춤,-1
해상운임 약세 속 HMM 대한해운 장중 주가 하락,-1
폴라리스쉬핑 2대주주 지분 인수 우협에 STX APC PE 선정,1
해상운임 촉각 속 HMM 대한해운 장중 주가 하락,-1
주가 큰 폭 하락 무슨 일,-1
주가 6% 강세 무슨 일,1
주가 9%↑ 245억 규모 케미컬탱커선 2척 시설 투자,1
한일네트웍스 주가 4%↑ 대주주 유베이스 변경 소식에 강세,1
한일네트웍스 매각 핵심 사업에 집중,-1
작년 영업익 1307억 전년比 16% 감소,-1
수급과 가치 52주 최고가 PER 5 3배,1
기업공시 2월 24일 계열사 한일네트웍스 주식 1030억 원 규모,0
회장 시세조종 혐의 부인,-1
주가조작 혐의 허기호 회장측 시세조종 안 해,-1
지주사 전환 3년 만에 사상최대 매출 전망,0
특징주 실외 마스크 착용 의무 해제되나 화장품株 강세,1
마스크 벗자 화장품주 웃었다 잇츠한불 20%대 급등,1
특징주 화장품 관련주 급등 코리아나 주가는,1
LG생활건강 화장품 상장기업 브랜드평판 톱 아모레퍼시픽 현대바이오 순,0
실적 개선 지난해 매출 678억원 전년비 9% ↑,1
매각 무산 쌍용차 인수전 뛰어든 쌍방울 3분 국내주식,-1
브랜드평판 화장품 상장기업 순위 1위 LG생활건강 2위 아모레퍼시픽 3위 현,0
주가 20%↑ 54년간 국내 화장품 산업 선도,1
주가 급등 정부 위드코로나 2단계 실외서 마스크 벗는 방,1
주가 4 33% 하락중,-1
산업현장 떠나지 않는 죽음의 그림자,0
거래소 미래에셋생명 등 11개사 유가증권시장 공시우수법인 선정,1
고용노동부 사망사고 관련 압수수색,-1
중대재해처벌법 줄줄이 입건 원 하청 책임소재 다툼 불가피,0
고용부 중대재해 업체 무더기 압수수색 대표 입건,-1
노동부 원 하청 모두 중대재해법 입건,0
산재 사망사고 곱지 않은 시선 받는 이유,-1
동해공장서 50대 노동자 추락해 숨져 노동부 중대재해 적용 사,-1
협력업체 50대 노동자 추락사 시멘트업계 1호 중대재해법 처벌,-1
실적 잔치 증권사 평균 연봉 2억원 시대 열렸다,0
보통주 130원 우선주 140원 현금 배당,1
더벨 하우스 분석 본업과 멀어지는 부동산으로 명맥 유지,0
지엔원에너지 국내 신재생에너지 시장 확대 수혜 유화,1
폴라리스웍스 자율주행 수혜 실적 턴어라운드 예상,1
증권사야 부동산 회사야 소액주주 행동주의 표방에 몸살,0
연속 순매수 기관 30일째 매수,0
주가약세 고배당 증권주 주목,-1
주가약세 고배당 증권주 주목,-1
해외주식 ELS 등 파생결합증권 5종 공모,0
테슬라 스타벅스 기초자산 등 ELS 5종 모집,0
한샘 불확실성 축소 기대 리하우스 중심 성장 유효 유안타,-1
롯데케미칼 공급과잉 문제 지속,-1
도이치모터스 절대적 저평가 구간 저가 매수 유효 유안타,0
단독 최대 1500억 회사채 발행,0
최대 1천500억 원 공모채 발행 채비,0
바이오플러스 바이오 플랫폼 회사로 변신 중,0
영림원소프트랩 중견기업 ERP 시장 지배력 확대 유안타證,1
용평리조트 주가 저평가 해소할 3가지 요인 유안타證,0
실적점검 4Q 영업이익 118억원 전년비 15 7%,1
자회사 대륜E&S 주당 530원 현금배당,1
주가 20%↑ 지난해 매출액 239억,1
특징주 한국가스공사 상승률 업종 1 2위 유가 상승 수,1
공시 지난해 영업익 71억 전년比 42 7%↑,1
가파른 하락세로 4% 낙폭 공매도 수량 0주,-1
보통주 주당 100원 현금배당,1
2022 ATW 올해의 화물 항공사 선정,1
화물운임 강세 여객 회복 1Q 호실적 전망 NH,1
노조 항공 수요 회복 위해 PCR 검사 면제해야,1
2022 ATW 올해의 화물 항공사 선정,1
임원인사 단행 전무 4명 등 15명 승진,0
항공화물 덕에 1분기 호실적 예상 국제여객 회복도 대신,1
주가 다시 날아오르나 리오프닝 좋은데 유가 급등 변수,1
올해의 화물 항공사,0
브랜드평판 항공사 상장기업 순위 1위 2위 한진칼 3위 아시아나항,0
해외여행 재개 기대감에 하나투어 브랜드 가치 급등,1
◇週間거래량 등략률 상위 10大株◇,0
◇週間거래량 등락률 상위 10大株◇,0
특징주 큐롬바이오와 세계최초 美 FDA 미토콘드리아 희귀의약품 협,1
해외통 이기수 대표 내세운 수출 부진 만회할까,1
특징주 의약 바이오 거래량 21배 폭등 주가는,0
이기수 대표이사 신규 선임,0
새 수장에 이기수 대표 취임,0
이기수 신임대표 선임,0
제약바이오 사령탑 교체 바람 경영진 새판 짜기,0
상장제약 3곳 중 2곳 코로나 2년 새 원가구조 악화,0
지난해 매출 1 961억 전년비 5 9%↓,-1
해외주식 양도세 및 종합소득세 신고대행 서비스 나서,0
ESG 경영 강화한다,1
한화證 GS리테일 비용 증가로 적자폭 확대 목표가 25%↓,-1
주식 양도세‧증여세 증권사 신고대행 화룡점정,0
투자와 콘텐츠를 한 번에 MTS 스텝스,1
유온인베스트먼트 열매컴퍼니 시리즈B 투자,1
지분이 든든한 해외사업 ESG 박차,0
제일기획 매수 추천‧목표가 상향 1분기 호실적 예상,1
삼성SDS IT서비스 물류사업 주목,1
더존비즈온 대외환경 비우호적 과도기 지속 한화,0
투명한 지배구조 확립 우수 기업 인정받아,1
원스토어 SK쉴더스 증권신고서 제출 5월 나란히 상장,0
대한항공 항공화물 덕에 1분기 호실적 예상 국제여객 회복도 대신,1
부음 이현래 IT개발부 팀장 씨 부친상,1
IPO‧ECM‧신기술금융 등 고른 성장 돋보이는 IB명가,1
2022 웰컴홈 이벤트 실시,0
대형 증권사 작년 평균연봉 1억5200만원 메리츠 2억원 1위,0
SPC삼립 포켓몬빵 매출은 2Q 반영 예상,0
취재후일담 투자일임 줄어든 배경은,1
리츠로 부동산업 강자 명성 이어간다,0
주가약세 고배당 증권주 주목,-1
주가약세 고배당 증권주 주목,-1
거래소 외인 증권주 중심 990억원 매수우위,0
외국인 삼성전자 5일째 순매도,0
외국인 삼성전자 SKT 1061억원 순매도,0
외국인 우선주로 매수 확대,1
외국인 기관 삼성전자 동반매도,0
거래소 외인 전기전자 금융 비중 축소,-1
거래소 외인 삼성전자 등 1 980억원 순매도,0
특징주 대신증권 자사주 매입 배당 결정에 3%대 강세,1
증권주 부진 속 빛나는 대신증권 금융위기 이후 첫 2만원대,-1
고공행진 KTB투자증권 올해 증권株 상승률 1위,1
보통주보다 비싼 증권사 우선주 속출 투자유의보 발령,1
증권주 오랜만에 웃다 악재 털고 줄줄이 상승,-1
B 4 83% 52주 신고가,1
B 52주 신고가 경신 단기 중기 이평선 정배열로 상승세,1
KIA에 9 0 완승,0
플럿코 무실점 서건창 3타점 4년 연속 개막전 승리,0
마레이 26득점 22리바 KGC 제압 6위 가스공사 1G 차 추격,0
KIA 양현종 또 개막전 징크스 전 6이닝 4실점,0
이겼다,0
플럿코 무실점으로 KBO리그 첫 승 양현종 패전,0
마레이 20 20 인삼공사 꺾고 6위에 1경기 차 추격 종합,0
복지재단 대표에 구본무 장녀 구연경씨,0
46억원 규모 사모 CB 발행,0
전환사채 전환가액 1455원 하향 조정,-1
제3자 배정 50억 유상증자 결정,0
100억 규모 전환사채 발행 결정,0
815억에 신사동 건물 매각,-1
전환가액 1609원 하향 조정,-1
초록뱀미디어와 95억원 규모 K Star 채널 양도 계약,0
65억원 규모 무기명 무보증 사모 전환사채 발행,0
지난해 상장법인 122개사 상호변경,0
S&T중공업 정리해고 노사갈등 악화일로,0
탱크 회사로 온 탱크주의 노조와 타협해야 창조경제 활력,0
D 19 대선 브리핑 오늘 후보들은 어디에,0
임단협 미타결 사업장 많다 금속 노동자 동투,-1
지난해 주당순이익 1위 방위산업주는 한국항공우주 왜,1
주가 5%↑ 상승 이유는,1
나노젠 나노코박스 수혜주 HLB HLB제약 혼조세 임상3상,1
나노코박스 관련주 HLB 에이치엘비 그룹주 주가는,0
나노젠 나노코박스 수혜주 HLB 상승 하락 긴급승인 언제,-1
나노젠 나노코박스 수혜주 HLB 3월 긴급승인 물건너가나,1
나노젠 나노코박스 수혜주 HLB 에이치엘비 주가 하락세,-1
주가 급등 나노코박스 승인 청신호,1
베트남 나노젠 수혜주 상승 나노코박스 기대감 여전,1
나노코박스 긴급승인 HLB 에이치엘비 그룹주 주가,1
나노젠 나노코박스 백신 수혜주 에이치엘비 주가 하락세,-1
꽃향기가 흐르는 평창 국토공원화사업 본격 추진,1
평창 평창 면 이달부터 국토공원화사업 본격 착수,0
광주광역시 남구 나눔 투어 세탁소 운영 등 돌봄사업 추진,1
광주 남구 2동 2차 집수리 지원사업 실시,1
광주 남구 2동 2차 집수리 비용 지원 최대 1200만원,1
특징주 면화 가격 급등에 7%↑ 52주 신고가,1
쌍방울 쌍용차 인수전 참여한다 뒷북비즈,0
쌍방울그룹 매각 무산 쌍용차 인수전 뛰어든다,-1
쌍방울 2000억 이미 준비 쌍용차 재매각 탄력받나 비즈360,-1
쌍용차 봄나들이 유류비 지원 등 4월 구매혜택,1
쌍방울 쌍용차 품을까 광림 나노스 등 그룹주 들썩,0
쌍용차 인수하겠다 쌍방울 광림 상한가,1
저대로만 나오면 산다 신차 J100 쌍용車 구원투수될까,0
매각 무산 쌍용차 감사 의견 또 거절,-1
쌍용차 3월 8596대 판매 올들어 처음 8000대 넘어,0
꼬이는 대형M&A 尹정부로① 1년 고스란히 날린 쌍용車 이번엔 쌍방울,0
지난해 영업익 355억원 전년比 89 4%↑,1
지난해 영업이익 355억 전년대비 89%↑,1
행복얼라이언스 부산 영도구 결식우려아동 위한 기부금 전달,-1
실적발표 액토즈소프트 모나미 이원컴포텍,-1
2021주총 부산서 4월 정기주총 첫 사례 나온다 다음달 9일,0
1주당 2100원 현금배당 결정,1
행복얼라이언스 복지사각지대 아동 위한 업무협약 체결,1
미창석유 올해 월 판매량 12만5000드럼 달성 목표,0
4월 정기 주총도 등장 미창석유 첫 개최,0
26년 연속 임금협상 무교섭 타결,0
26년 연속 임금협상 무교섭 타결,0
포스코 대기업 첫 재택근무 중단 4일부터 대면근무 체제로 전환,-1
2년 내 배터리 양극재용 리튬 100% 자급,0
26년 연속 임금협상 무교섭 타결,0
2024년 리튬 자급률 102％ 소재 경쟁력 강화,1
리튬 안정적 확보로 배터리소재 경쟁력 높인다,0
포스코홀딩스 그룹 ESG 협의회 개최 ESG 경영 강화,1
특징주 미국발 훈풍에 120층 돌파,1
배터리 소재 전문 인력 육성 포스텍 맞손,0
주가 급등 러 우 평화협상 낙관론↓,-1
장중 주가 대폭 상승 러시아산 수산물 수입 차질 우려에 부각,-1
러시아 발 수산물 가격 상승 주가 17% 급등,1
주가 17%↑ 상승 이유는,1
특징주 주가 상승세로 출발 뒷배경 알아보니,1
동원수산 上 이번엔 수산주 랠리,1
수산물 가격 상승 여파에 상한가,-1
특징주 러 항공로 페쇄 운임비 증가 연어 가격 폭등에 강세,1
우크라 침공 코리안리 월드비전에 5천만원 기부,0
이슈 코리안리 올해도 실적 개선세 지속 주가도 껑충,1
