title,label
더벨 대우조선 매각 무산 반사이익 보나,-1
유가증권시장 공시 신성이엔지 부국증권,0
친환경 전기차의 새로운 미세먼지 막아라 저감기술 개발 시동,1
3거래일 연속 상승에 1만원선 재돌파 공매도 수량 10주 미만,1
러 우크라이나 사태 주가 10% 강세,1
가파른 상승세로 10% 급등 공매도 수량 10주 미만,1
주가 10%↑ 300억 규모 시설증설 투자 결정,1
300억 규모 시설증설 투자 결정,1
실적 껑충 이차전지 진출한다 전기차 배터리 다크호스 될까,1
ET라씨로 작년 영업익 41%↑ 실적 호조에 주가 강세,1
실적 호조에 3거래일 연속 상승 주가 5 8%↑,1
1주당 150원 결산배당 작년 영업익 41%↑,1
특징주 AM사업부 판매량 확대 소식에 7%↑,1
특징주 깜짝 실적 내놓자 개미들 주가 초관심,1
지난해 영업익 40% 껑충 AM 덕에 쾌속성장,1
단독 장세욱 동국제강 부회장 철근 담합 감독 소홀로 국민연금서 사내이,0
25일 주총,0
KCC 한국전력 3월 첫째주 금융투자 기관 순매수 TOP3,1
여전히 밸류에이션 매력 충분,0
스타애널 박현욱 현대차증권 연구원 으로 수익률 1위,1
중기부 사내벤처 육성프로그램 운영기업에 선정,1
전쟁 공포마저 이겼다 메리츠금융 급등한 이유는,1
업황도 좋은데 대규모 자사주 매입은 덤 매수 키움증권,0
시간외 주가도 급등 무슨 일,1
야속한 코로나 심란한 연말,0
연속 순매도 외인 23일째 매도,0
코로나19 장기화에 적자 중간배당 지속 여부 촉각,-1
버스기사 백신 우선 접종 지정 천일고속 주가 급등,1
더벨 고배당주 15년 연속 결산배당 행진 멈춤,1
코로나19 에 직격탄 대규모 적자에 털썩,-1
공시 작년 영업손실 216억원 적자전환,-1
지난해 영업손실 215억원‥적자전환,-1
2020 실적 작년 영업익 215억 코로나 직격,1
대구 벚꽃축제 개막,0
로이드 엘다이아 컬렉션 화보 공개,0
83타워 명칭 변경 대구 측 황당하다,0
주가 훈풍 토스 관련주 부각,1
결혼정보회사 노블레스 수현 대구 여행지 3곳 추천,0
토스 관련주 꼽히며 이번 주 주가↑,1
라이센스 유통 PICK 전자랜드 로이드 롯데홈쇼핑 外,0
낭만가득 대구 봄나들이 팔공산과 비슬산 벚꽃 진달래 안 보면 후회 합니,0
정육각 초록마을 900억에 인수,0
17기 주주총회 보통주 1주당 240원 배당,1
초록마을 지분 443억 처분 결정,-1
미래 먹거리는 바이오 3세 경영 본격화한 대상 세포 재생 의약품社 투자,1
3세 경영 본격화 임세령 대상 부회장 연봉 11억 수령,0
시그널 대상 임세령 임상민 자매 초록마을 매각 수혜 독점,-1
대상그룹 산불 피해 복구 1억8000만원 기부,-1
보통주 주당 240원 현금배당,1
대상 임세령 육류 바이오로 미원 신화 새로 쓴다,0
정육각 대상 자회사 초록마을 900억 원에 인수,0
만우절 맞이 온라인 이벤트 실시,0
계열사 주식 29만여주 취득 결정,1
유가증권시장 공시 신영와코루,0
내달 30일 정기주총 소집,0
지난해 영업익 54억원 흑자 전환,1
공시 자회사 매각 추진설에 MOU 체결,-1
백가호 매각추진 업무협약 후 협의 중,-1
TBH 中백가호시장유한공사 매각 협의중,-1
세종병원 비뇨의학과 신규 개설 운영,0
맥스 금기창 연세암병원장 사외이사 선임 글로벌 임상 협력,1
메딕바이오 케어플러스 인수 MOU,0
KRX헬스케어 엔지켐생명과학 맥스 박셀바이오 3월 중 시총 순위,0
제약 바이오기업 반려동물 시장 정조준,0
실적점검 21 4Q 영업이익 23억원 PER 7 2배,1
맥스 NK세포 활성도 높을수록 염증반응 낮아,0
김범수 카카오 이사회 의장 물러나 글로벌 총괄 로 전사 메시지 공유,0
NKCL바이오그룹 씨엘바이오그룹 2022 명품브랜드대상 2관왕 수상,1
지난해 바이오 판관비 많이 썼지만 알차게 썼다,0
미래에셋생명 등 11개사 코스피 공시우수법인 선정,1
미래에셋생명 맞춤식 설계 헬스케어 종합보장보험 눈길,0
공시우수법인 선정 미래에셋생명 포함 11개사,1
증권소식 IPO 뻥튀기 청약 방지 기관 수요예측 요건 강화 미래에셋생명,1
좋은기업연구소 최현만 미래에셋증권 회장 이사선임 반대,0
더벨 보험경영분석 미래에셋생명 제판분리 효과로 영업실적 나홀로 성장,1
더벨 금융 人사이드 미래에셋생명 변재상 김재식 투톱체제 본격화,0
미래에셋생명 4분기 영업익 346억 흑자전환,1
속보 미래에셋생명 즉시연금 2심 패소 소비자측 항소심 첫 승소,-1
완성차 해상운송 화재 대응 시스템 강화,1
KB證 목표주가 4 5%↑ 공급망 교란 수혜,1
1Q 영업익 컨센서스 상회 우호적 환경 지속 현대차,1
전기차 운송중 선내 화재 대비 특수장비 배치,0
현대차그룹 중고차 사업 진출 수혜 목표가 13%↑ KTB,1
HMM 출신 김경배 신임 대표이사 선임 톱클래스 선사로 도약,1
현대차든 포스코든 주주들이 주총서 다시 쏘아올린 HMM M&A,1
1분기 실적 호조 전망 전반적인 물동량↑,1
삼성 현대 테슬라도 꼽은 미래 신사업은,0
현대차그룹 아람코 손잡고 친환경엔진 연료 개발 나서,1
롯데카드 매각 추진 인수 후보 우리 하나 KT 등 거론,-1
함영주 하나금융 회장 취임 아시아 최고 금융그룹 도약,1
속보 함영주 하나금융 회장 선임안 주총 통과,0
시골촌놈 함영주 하나은행 입행 42년만에 하나금융 회장으로,0
함영주 하나금융 회장 취임 후 첫 행보로 동해안 산불 피해지역 방문,-1
하나금융 의류 기부 캠페인 해봄옷장 실시,0
하나금융 10년만에 수장 교체 차기 회장에 함영주 종합,0
함영주 하나금융회장 선임안 통과 금융지주 수퍼주총데이 마무리,0
함영주 하나금융그룹 회장 선임안 통과,0
하나금융 새 수장 함영주 고졸 은행원에서 회장까지,0
한화생명 첫 무배당 결정에 희망퇴직도 받아,1
자필서명 미이행 특별이익 제공 보험설계사 무더기 제재,1
더벨 한화생명 재무적 투자자 로 리치앤코 200억 출자,1
한화생명 GA설계사 지원 시스템 오픈,1
더벨 메리츠금융 한화생명 GA 리치앤코에 1200억 투자,1
주총 한화그룹 3세 김동관 ㈜한화 사내이사 선임 지배력 확대,1
현대重 한화 효성 3세 경영 본격화 신사업 준비 속도,0
FOCUS 한화그룹 김동관 꽃 활짝‥다음 스텝은,0
일감 몰아받은 김동관을 또 한화 이사에 앉힌다고,0
KB손보가 쏘아올린 빅데이터 판매 보험업계 대세될까,0
군 코로나19 극복 지역 경기 회복 최선 노력,1
군 남종화 대가 소치 일가 5대 미술관 개관,0
맞춤형 가족 서비스 제공 군 가족센터 착공,1
군수 여론조사를 왜 강진군민에게 하나,-1
군 마을 단위 LPG 배관망 구축사업 2개 마을 선정,1
군 소치 일가 5대 미술관 개관,0
군농협 영농폐기물 수거 캠페인,0
씻김굿과 함께 빌어보는 소원성취 공연 천궁,0
군 기본형 공익직불제 접수 실시,0
소방서 제1회 의용소방대의 날 행사 개최,0
fn마켓워치 맥쿼리인프라 인천김포고속도로에 투자,1
맥쿼리인프라 7년만에 국내 철도투자 재개,1
더벨 맥쿼리인프라 유증 흥행 청신호 수익 안정성 부각,1
레이더M 오는 4 5일 유증 나서는 맥쿼리인프라 유증확정가 1만2050원으로,0
IB토마토 맥쿼리인프라 4천억 규모 유증 흥행 도시가스 투자 확대,1
더벨 맥쿼리인프라 유상증자 흥행 기관 개인 다 잡았다,0
공시 예스코홀딩스 주식 전량 매도 결정,0
맥쿼리인프라 상반기 분배금 27일 지급,0
맥쿼리인프라 도시가스 진출 서범식 사업 안정성과 영속성 일석이조,1
광주시민 반발 속 맥쿼리인프라 해양에너지 서라벌도시가스 인수,0
여천NCC 찬밥 눈치보는 기업은 늘었다,0
로지스올 와 친환경 사업 강화를 위한 업무협약 체결,1
Who Is 정몽규 HDC 대표이사 회장,0
주당 140원 현금배당 결정,1
로지스올 친환경 사업 강화,1
더벨 위기의 HDC현산 계열사 불똥 공모채 발행계획 전면중단,-1
더벨 A 등급 공모채 도전 ESG로 투심 겨냥,0
특수합금패널 시스템욕실 평택아이파크 적용,0
특징주 주가 상승세 3분기 매출액 주목,1
CJ제일제당 와 바이오 컴파운딩 합작법인 JV 설립 본계약,0
5개 항공사 시총 코로나 이전보다 200% 늘어 대한항공 안전지대,0
봄맞이 항공권 할인 프로모션,0
제주산품 판매 확대,1
2022년 브랜드 캠페인 슬로건 공개,0
브랜드 캠페인 슬로건 공개 YES YOU CAN FLY,0
브리핑 에어부산,0
지는 코로나에 뜨는 항공사‥무르익는 대한항공 등 봄맞이 기,0
해외여행 수요 기지개 티웨이항공 적자 늪 탈출 기대감,-1
제주 항공권 쏘겠다는 조성환 감독 1만명 이상 온다면,0
브랜드평판 항공사 상장기업 순위 1위 대한항공 2위 한진칼 3위 아시아나항,1
주가 급락 무슨 이슈 있나,-1
핫이슈 테마주 한미 수소산업 경쟁력 강화 추진 수소 관련주 급등,1
자동차부품업계 전년 연간실적으로 희비 엇갈려 대유에이텍 전년 순이익 72,1
취재후일담 제네시스 G90 에어서스펜션 누가 만들었나 현대모비스 평화산,0
평화홀딩스 상승에 급등까지 5% 급등 이어 평화홀딩스,1
고객과 함께 가치를 올리다 캠페인,0
의 ESG 디지털 경영 77년 도전史의 연장선이죠,0
특징주 노루홀딩스 재건축 기대감 계속 갈까 오전 주가 시황,1
업계 유일 ESG 통합 A등급 남다른 혁신 경영,1
주가 강세 재건축 규제 완화 수혜,1
페인트社 미래산업에 색을 입히다,0
페인트업계 연봉킹은 한영재 회장 25억9500만원,0
특징주 노루홀딩스 주가 상승세↑ 무슨 이유길래,1
조성국 단독 대표 체제로 변경,0
서울노인복지센터 와 업무협약 체결,1
특징주 주가 소폭 상승 탈모약 반값 시행 기대감,1
실적점검 21 4Q 영업이익 1억원 적자지속,-1
탈모주 왜 다시 오르지 안철수 효과,0
코스피 코스닥 동반상승 출발 TS트릴리온 플랜티넷 급등,1
ET라씨로 자라나라 머리머리 TS트릴리온 등 탈모株 강세,1
이주의 주식시장은 코스피 2700 회복 윤석열 당선인 관련주 화제 삼성전자,1
미용성형 사업 손익 개선 추이 주목,1
뷰티 구독 플랫폼 구축 속도 포스트 코로나 수혜 기대,1
특징주 이재명 탈모주 TS 모발이식 플릿폼 진출 모발이식 국,1
롯데온 설화수 등 과 특별 할인 이벤트,0
직원이 기부하면 회사도 그만큼 1억5천만원 기부,0
회사 임직원 1억 5천여만 원 기부,0
아모레 LG생건 더마 경쟁력 강화에 집중 영토확장 속도전,1
커스텀미 캐시워크 돈버는 퀴즈 정답 공개,0
미술관 안드레아스 거스키 신작 세계 최초 공개,1
대중국 수요 위축으로 목표가 16%↓,-1
염색 탈모까지 아모레 LG생건 기능성 샴푸 시장 공략하는 이유는,0
미술관 안드레아스 거스키 국내 첫 개인전 개최,0
中 망고펀과 모바일게임 퍼블리싱 협약,1
전종태 대표이사 사임,0
강세주 8% 상승 NFT 메타버스 사업 부각,1
와이지비에스 NFT와 메타버스 사업 본격 추진 위해 와 MOU,1
와이지비에스와 NFT 메타버스 MOU 체결,1
메타버스 NFT 게임 신작 라인업 5종 공개,0
우주항공산업 관련주 전일대비 1 88% 하락 는 3 86% 상승,-1
줄기세포 관련주 3 86% 상승세 프로스테믹스 부광약품 희비,1
신작 창공아레나 앱스토어 및 원스토어 원게임루프 출시,1
특징주 올해 출시 에정 게임사업 라인업 발표에↑,1
해외여행 수요 기지개 제주항공 적자 늪 탈출 기대감,-1
정홍근 대표 사내이사 재선임 LCC 최장수 대표,0
정홍근 사장 3연임 성공 재운항 대비 과감한 투자,1
5개 항공사 시총 코로나 이전보다 200% 늘어 대한항공 안전지대,0
결식 위기 아동 식사 지원 달력 판매 수익금 기부,-1
특징주 국제유가 급락에 항공주 방긋 진에어 4%↑,-1
위기의 항공업계 입국 시 PCR 검사 면제해달라,-1
중대형기 김포 제주 노선 투입 1만6600원부터,0
아시아나 2300% 티웨이 1494% 항공사 부채비율 빨간불,-1
대구공항에 도착한 항공기 바로 인천공항으로 출발 왜,0
흑자전환에 美 켄터키 공장 투자 본격화,1
현대차 전기차에 95조 원 투자 발표 주가 상승세 보여,1
주가 13%↑ 쿠팡 때문에 급등세 왜,1
Bull&Bear 전기차 모멘텀 타고 급등,1
특징주 현대차 관련주 오전 주가 시황,0
지난해 영업익 271억원 흑자 전환,1
특징주 테슬라 에도 부품공급하는 미국 현지생산 협의 소식에,1
낮부터 폭발적 매수세로 상한가 공매도 수량 10주 미만,1
바이오엑스 그린수소 생산 폐액 무방류 시스템 실증화 시설 적용,0
특징주 KEC 주가 16% 상승세 전기차 부품 공급,1
충북 전문건설업체 공사수주 1위 1664억원,1
바이오엑스 시스템과 그린수소 생성 실증화사업 업무협약 체결,1
구미공장 생산 중단,-1
㈜ 차량용 공조기 Blow Motor 향 LV MOSFET 출시,1
과학교육재단 장학금 수여식,1
과학교육재단 구미 해평초에 후원금 전달,0
더벨 CVC 설립 밑그림 정관 변경 추진 예고,1
KPX생명과학 적자 끊을까 차남 최대주주→등기임원 예고,-1
실적점검 3Q 영업이익 91억원 PER 2배,1
120억원 규모 자사주취득 신탁계약 해지,-1
주당 750원 분기배당 시가배당률 1%,1
지주비율 개선 가능할까,0
화이자 경구용 치료제로 매출 장밋빛 KPX생명과학 제일약품 우,0
특징주 주가 상승세 숭이익 48% 급등,1
3월 결산 4분기 영업이익 31억 전년비 36%↑,1
공시 주당 150원 현금배당 결정,1
저PBR 수익성 개선이 관건 PBR 0 6배,1
특징주 10% 연일 상승세 윤석열 관련주,1
20%대 급등 윤석열 지지율 얼마나 올랐길래,1
주식 장 초반 19% 일주일만에 돌아온 파평 윤씨 윤석열 테마,0
주식 윤씨면 일단 주목 윤석열 관련주 소식에 13%강세,1
아떼 바네사브루노 프렌치 감성 테니스 캡슐 컬렉션 출시,1
아떼 바네사브루노 MZ테니스족 겨냥한 테니스 캡슐 컬렉션 선보여,0
푸드 크라제 미국 프리미어 수제버거 밀키트 출시,1
렉서스코리아 전기차 콘셉트카 Z 일렉트리파이드 특별 전시,0
회장님의 선견지명 3년 만에 캐시카우가 달라졌다,0
동물실험 동물성 원료 NO 난 착한 화장품 만 쓴다,0
양재택 전 검사 사외이사 자진 사임,0
트라이씨클 라이브커머스 시작한다,0
아성다이소 와 함께 하프클럽 보리보리 진행 4월 30일까지,0
비싼 향기 에 빠진 향수 애호가들 유통업계는 향수앓이 중,0
093230 오후 12시 31분 기준 및 주체별 매매동향,0
23일 데일리 증권 093230 오후 12시 33분 기준 외 주식시황,0
16일 데일리 증권 093230 오후 12시 25분 기준,0
데일리 주가정보 093230 오후 12시 38분 기준,0
데일리 주가정보 093230 오후 2시 23분 기준,0
093230 3일 3 94%변화,0
093230 28일 2 40%변화,0
엘리트학생복 초성 퀴즈 이벤트 진행한다,0
스포츠상품화 사업 매출 확대 기대,1
TS트릴리온 이재명 테마주 낙선에 주가 뚝 증시이슈,0
윤석열 당선 후 날아오르고 추락한 테마주들,-1
엘리트학생복 소비자선정 최고의 브랜드 대상,1
엘리트학생복 소비자선정 최고의 브랜드 대상 수상,1
청소년 99% 소년법 개정 폐지 찬성 촉법소년 연령 낮춰야,0
탄소저감에 흑자전환 업사이클링 의 힘,1
페트병 업사이클링 의류 확대,1
더벨 진격의 중견그룹 현대차 방계 은 왜 삼성맨을 영입했나,0
동진쎄미켐‧케이피엠테크 하락 반해 상승 일본 수출 규제 수혜주 희비,-1
더벨 진격의 중견그룹 지배구조 정점 HDS 무늬만 그룹 지주사,0
더벨 진격의 중견그룹 2세 경영 10년차 더 보수적으로 변한 재무 전,0
더벨 진격의 중견그룹 고속성장 김근수가 점찍고 김용민이 키웠다,1
더벨 진격의 중견그룹 은둔의 경영자 김근수 회장 주식 대량 매도,0
코골이 수면무호흡증 노화 촉진한다,0
에피큐어 유전학 기반의 치매 치료 물질 개발 착수 인체적용시험 준비,1
수면무호흡증 생물학적 노화 촉진한다,0
하락 이어 동진쎄미켐‧케이피엠테크 일본 수출 규제 수혜주 모두 하락,-1
이사 겸직 하는 한화 효성 3세 영향력 행사에 보수 는 덤,0
총수 책임경영 나서는 효성 한화 조현준 김동관 사내이사 선임,0
박스권 장세에 안정적 수익 매력↑ 분기 배당株 노려볼까,1
조현준 효성 회장 워라밸 문화 확산 앞장,0
조현준 효성 회장 워라벨 문화 앞장 리프레시 휴가 권장,0
효성 계열사 배당 모 아니면 도 효성티앤씨는 10배 늘었다,1
KG ICT 와 매장 토탈 솔루션 사업 추진,1
내달 23일 정기주주총회 배당금 의결 등,1
경제개혁연대 효성 경영비리 조현준 조현상 이사선임 철회 국민연금 반대해,0
보통주 300원 우선주 305원 현금배당 결정 주목 e공시,1
더벨 미래에셋운용 맵스리얼티1 토지 일부 매각,-1
더벨 미래운용 앓던 이 브라질 부동산 매각 성공,-1
더벨 미래에셋운용 5년만에 맵스리얼티1 매수 왜,0
미래에셋맵스 아시아퍼시픽 부동산공모1호 상장,1
더벨 플랫폼운용 맵스리얼티1 투자 행동주의 나설까,1
더벨 미래에셋운용 TIF 1000억 성장 미래대우 후방지원,1
미래에셋맵스운용 홍콩 부동산 처분 현금화,-1
미래에셋맵스운용 홍콩 부동산 86억 처분 현금화,-1
미래에셋맵스운용 홍콩부동산 투자,1
미래에셋맵스 부동산펀드 배당수익 짭짤,1
주가 2%↑ 삼부토건과 원전해체사업 협력 MOU 체결,-1
삼부토건 과 원전해체사업 협력 MOU 체결,-1
2022 주총 김형종 현대百 사장 글로벌 온라인으로 포트폴리오 확장,1
한국무역협회 충북기업협의회 해외시장 공략 재도약 꿈꾸다,1
3월 30일 워크넷 채용정보 나이스플러스 성호스텐 프라스틱 한남하이,0
특징주 주가 상승세↑ 무슨 이유길래,1
문화재단 제31회 신예작가 초대전 24일 팡파르,0
희망나눔 프로젝트 76 태권도 메달리스트 꿈꾸는,0
실적점검 4Q 영업이익 9억원 PER 9 9배,1
1주당 500원 현금배당 결정 총 11억5757만원,1
연속 순매도 외인 30일째 매도,0
3월31일 정기주주총회 개최,0
최대주주 소유주식 변동 신고,0
지난해 영업익 301억 전년비 38 3% ↑,1
주가 10 15%↑ 올해 2분기 매출액 1035억원,1
지아패브릭 벽지 4년만에 리뉴얼 출시,1
지아패브릭 벽지 리뉴얼 출시,1
LX그룹 유리황제 KCC에 도전장 5000억 시장 지각변동,0
fn마켓워치 LX인터 한국유리공업 인수 마무리 5925억 규모,0
외연 확장 시동거는 LX인터내셔널 구본준 LX號 선봉 맡는다,1
건축 건설기자재株 봄바람‥ 이익증대 기대감,1
주총 강계웅 대표 토탈인테리어 B2C 강화로 수익 혁신,1
LX 홀로서기 1년 구본준號 주력 계열 사업다각화 가속,0
승부사 구본준 투자 본능 꿈틀 LX 성장 기반 다진다,1
과감한 투자 덩치 키우는 LX그룹,1
고층건물 화재진압용 드론 실증사업에 중계기 공급,1
1년 8개월 끌어온 유상증자 결국 철회,0
에치에프알과 맺은 중계기 공급계약 종료일 연기,1
에치에프알에 13 4억원 규모 중계기 공급키로 주목 e공시,1
엘지유플러스와 21억 공급계약,1
더벨 적자 탈출한 상장적격성 실질심사 결론 초읽기,-1
KT에 7억원 규모 5G망 다중화장치 공급,1
더벨 상반기 순익 전환 알에프윈도우 합병 효과 본격화,1
어스아워 Earth Hour 캠페인 4년 연속 동참,0
정기 주총 마무리 성래은 사장 의장으로 참석,0
올해도 어스아워 소등행사 진행,0
NH證 섬유의복산업 비중 확대 추천 수혜주 F&F,1
성기학 본업 부업 다 잡나 코로나에도 실적 개선 성공,1
지구를 위한 1시간의 선물 어스아워 2022 참가,0
성기학 홀딩스 거수기 역할도 못한 사외이사에 보수 따박따박,0
실적 반짝 아쉬운 주가,0
부녀경영 성기학 성래은 지난해 보수 33억 원,0
홀딩스와 숙명여대 의류학과의 콜라보 업사이클링 프로젝트 발표회,0
노사 조직문화 혁신 공동 캠페인 개최,1
노사 리본 RE BORN 노사 공동 캠페인 개최,0
2021년 유가증권시장 공시우수법인 선정,1
2021년 유가증권시장 공시우수법인 선정,1
GKL 강원 경북 산불 피해복구 성금 기탁,-1
강원 경북 산불 피해 복구에 써달라 성금 3000만원 기탁,-1
공공데이터 제공 운영실태 2년 연속 우수,1
쿡웨어 소형가전 시장 승부 발빠른 라인업 현지 밀착,0
스팀프라이어 S2 출시 한달간 온라인 페스티벌,1
라이프 스타일 기업 변신 승부 본점 매각해 현금 마련,-1
동원시스템즈 포장재사 브랜드평판 1위 엠투엔 순,1
현대홈쇼핑과 락스타 페스티벌 진행,0
김성훈號 소형가전 사업 키워 성장세 지킨다,1
경영 효율화 고삐 어피너티 엑시트 시동,0
유통오늘 텐고 육그램과 입점 제휴 현대홈쇼핑서 스페셜,0
2022 상반기 메가세일 최대 80%할인,0
주가 상한가 가스 공급 비상사태,1
도시가스 수혜주 중앙에너비스 한국가스공사 상승 가스요금,1
ET라씨로 러 우크라 협상 낙관론 후퇴 에너지株 상승,0
시간외Y 지에스이 중앙에너비스 켐온 上,1
러시아 우크라 공격 지속에 지에스이 등 에너지주 강세,1
특징주 에너지株 국제유가 배럴당 110달러 돌파에 강세,1
코스피 장 초반 하락 출발‥에너지 관련주 상승,-1
우크라 협상 기대감 후퇴에 석유 가스 등 에너지株 상승,1
주가 약세 국제유가 약세,-1
수년째 적자 겪는 투자 수익으로 경쟁력↑,-1
본업 수년째 적자 부업 투자 고수익,-1
주가 급등 무슨 이슈 있나,1
주가 강세 버킷스튜디오 주식 350만 주 취득,1
초록뱀컴퍼니 주식 1666만주 취득 결정,1
시간외 주가 약세 오징어게임 관련주,-1
투자 평가이익 269억 원 시총 대비 18 83%,1
가파른 상승세로 4% 상승 3거래일만에 반등,1
현대제철 우수 협력사 효준정밀 에코파트너십 인증,1
유상증자 신주발행가액 5750원 확정,0
현대제철 친환경 우수 협력사로 효준정밀 2개사 선정,1
회처리설비 입찰 담합 비디아이 52억 과징금,-1
대만전력공사에서 4656억 공사수주,1
세계로 나가는 클린테크 코리아 환경기술 선두주자,0
세계로 나가는 클린테크 코리아 환경기술 선두주자,0
장원영 대표 체제로 변경,0
주당 1500원 현금배당 결정,1
온산 주식회사에 100억 금전대여 결정,0
작년 연간 영업익 141억 전년비 11%↑,1
연속 순매수 기관 22일째 매수,0
2Q 영업이익 39억 전년비 11 3%↑,1
특징주 주가 급등하며 18만 선 돌파,1
4일 오전 특징주 ‧한국선재 상한가‧CS홀딩스‧노루홀딩스우 강세,1
한국선재 급등 반해 가파른 하락세로 9% 급락 상한가 하루만에 하,-1
20 4Q 영업익 29억 전년비 24 5%↓,-1
코오롱FnC 자사 브랜드 전용 온라인 중고 마켓 시범 운영,0
코오롱스포츠 중고 옷 받아요 릴레이 코오롱FnC 중고마켓 서비스 론칭,1
코오롱스포츠 아웃도어용 테크 스니커즈 무브 업그레이드,0
코오롱인더 분사한 사내벤처에 통큰 투자,1
코오롱 볼디스트 쉴드 컬렉션 재킷 팬츠 출시드 컬렉션 강화에 나섰다,1
전기차 소재도 특수 코오롱 첨단 타이어용 수지 9개월만에 대박,0
타이어코드 이어 아라미드까지 코오롱인더 공장 증설 속도낸다,1
코오롱 차세대 수소전기차 핵심부품 수분제어장치 세계 시장 1위,1
실적점검 21 4Q 영업이익 126억원 PER 9 2배,1
특징주 지아이셀 세계최초 모든 암 잡는 NK세포 대량 배양,1
지난해 영업익 454억원 주당 150원 배당,1
밸류포인트 지분 80% 260억원에 취득,1
고배당 올해 외형 성장 견조,1
국내 소재 광고물제조사 지분 인수 양해각서 체결,-1
동영상 바닥권서 반등 시도하나 삼성그룹에 의존 물량 많,1
실적점검 3Q 영업이익 116억원 PER 12 6배,1
유가증권시장 공시 코오롱글로벌,0
3분기 영업익 116억 전년비 18 7% ↑,1
특징주 실외 마스크 착용 의무 해제되나 화장품株 강세,1
마스크 벗자 화장품주 웃었다 잇츠한불 20%대 급등,1
3년 만에 엔데믹 국면으로 벚꽃 피는 화장품 주류,0
노 마스크 기대감 잇츠한불 하이로닉 등 화장품 미용기기株 강세,1
특징주 화장품 관련주 급등 코리아나 제조 주가는,1
