title,label
6% 급등에 2만5000원선 재돌파 공매도 수량 23주,1
주당 900원 결산배당 내달 24일 정기주총 소집,1
작년 연간 영업익 351억 전년비 138%↑,1
무역의날 금탑산업훈장 정연택 대표 컬러강판 국산화로 국가 경쟁력,1
일본 수입 의존하던 컬러강판 국산화 성공,1
무역의날 1억불탑 제품 개발과 해외시장 개척으로 수출 확대,1
아주스틸 IPO로 저평가 실적주 부각,1
실적점검 3Q 영업이익 121억원 PER 6 9배,1
산업은행 결국 부산 가나 수은 기업銀도 비상,0
정부 우크라 사태 피해기업에 2조원 긴급 지원,-1
기업은행 노조 노조추천이사제 도입 촉구 윤종원 기업은행장 약속 행방은,0
기업은행 노조 노조추천이사 사외이사로 임명하라,0
토사대구팽 산은 부산行 솔솔 기업은행 대법원 유치 외면당한 대구,0
금융위 우크라 사태 피해 기업에 특별대출 2조원 공급,-1
산업은행 부산 이전 공약 실현되나 금융 공기업들 뒤숭숭,0
금융 라운지 은행연합회 채용에 産銀이 관심 갖는 까닭은,1
IB토마토 기업은행 첫 번째 노조 추천 이사 탄생 임박 결정은 금융위로,0
정부 15일부터 우크라 피해기업 특례보증 지원,-1
펩타이드 활용한 더마화장품 개발 나서,1
안병준 대표이사 선임,0
노바셀과 스킨케어용 펩타이드 원료물질 공동개발 협약,1
라이센스 뷰티 헬스 PICK LG생활건강 제일파마홀딩스 外,0
한국콜마 산불 피해 지역에 구호 물품 지원,-1
더벨 전자투표 정관 도입 G등급 오를까,0
합작법인 파마사이언스코리아 지분 정리,0
보통주 245원 우선주 245원 현금배당,1
지난해 영업익 30억 적자 전환,-1
실적발표 케이탑리츠 금호에이치티 태평양물산,-1
유가급등 수혜보나 주가 훨훨,1
특징주 소폭 상승 미국 증시 리비안 강세,1
특징주 소폭 상승 리비안 올해의 트럭 선정 여파,1
특징주 주가 10% 상승 재료 는 116조 원의 이것,0
주가 10%↑ 주가 급등한 이유는 이거 때문,1
특징주 주가 급등한 이유 알고보니 관련주 이슈,1
13% 급등에 4500원선 재돌파 공매도 수량 50주,1
주가 11%↑ 리비안 픽업 트럭 올해의 트럭 선정 소식에 강세,1
한화디펜스 대형 1MWh급 이상 선박용 ESS 시스템 MOU 체결,1
협착사망사고 에 법원 무죄 선고 사고 기계 프레스 로 볼 수 없,-1
44억원 규모 채무보증 결정,0
주가 9%↑ 품질 기술 상생협력 분야 5스타 등급 달성,1
품질 및 기술 상생협력 등 3가지 분야 5스타 등급 달성 쾌거,1
북구재가노인지원센터 백미 전달,1
주가 훈풍 그래핀 나노복합재료 제조특허 부각,1
전기차 에너지 저장장치로 미국 진출,1
제58회 무역의 날 등 17개사 수출탑,1
대한민국 산업기술 R&D대전 자동차부문 국무총리상,0
더벨 KPX홀딩스 CVC 설립 밑그림 정관 변경 추진 예고,1
경상국립대 업무협약 체결,1
경상국립대 신사업 개발 산학과제 공동 발굴 업무협약체결,1
외형 상승은 어렵지만 영업이익 성장은 가능할 것,1
지난해 영업익 447억 전년비 30 3%↓,-1
실적점검 3Q 영업이익 71억원 PER 4 7배,1
헌츠만 폴리우레탄 솔루션 합작법인 설립,0
올해 주당배당금은 지난해 2750원 와 같이 적용,1
더벨 SJM홀딩스 CVC 설립 카드 만지작 정관 변경,0
공시 지난해 영업익 64억원 전년비 1 2%↑,1
주당 175원 현금 배당 결정,1
지난해 영업익 67억 원 전년 대비 276 9%↑,1
실적발표 에이커스 에이블씨엔씨 남화산업,-1
특별관계자 지분변동,0
보통주 1주당 450원 배당 내달 25일 주총,1
25억 규모 현금배당 주당 250원,1
공단소방서 화재 예방 위한 관서장 현장예찰,0
주식회사 등 인천시 남동구 저소득층에 나눔 릴레이,0
전장부품사의 질주 자산 1조 시대 글로벌 공략 초읽기,0
전장부품사의 질주 유럽생산기지 수익성 반등 걸림돌,1
주식회사 등 남동구 저소득층에 나눔 릴레이,0
보통주당 450원 현금배당 결정,1
공시 지난해 영업익 791억 전년비 135 9%↑,1
공시 한일현대시멘트 3대 주주로 등극 지분 3 48% 확보,0
전남도 미래 산업 선도 7개 기업에 3천418억 투자,1
진주시 4차 산업혁명 스마트교육 추진 4자 협약 체결,1
신산업벨트 메가시티 추진 서울공화국 해법 기대감 심층기획 尹정부,1
부천시 5대 특화산업 R&D기관 성과보고회 개최,1
尹 당선인 네덜란드 총리와 통화 반도체산업 협력 확대하자,1
경남 양산시 전문가 초청 제2차 전략회의 개최,0
롯데케미칼 수소 배터리소재 미래사업으로 화학 한계 넘는다,0
소프트웨어 로봇 미래사업 인재 확보에 고용 기지개,0
실적점검 4Q 영업이익 53억원 적자지속,-1
작년 영업손 184억 적자폭 50 6% 커져,-1
피부미용 관련주 정부 확연한 감소세 확인시 야외 노마스크 검토,-1
토니모리 화장품주 상승에 급등까지 특히 토니모리 8% 급등,1
특징주 리오프닝 수혜주 오후 주가 시황은,1
특징주 왜 올랐나 봤더니 RCEP 출범 영향,0
설 선물 대전 프로모션 진행,0
설 맞아 남성 전용 피부 진정 제품 리뉴얼 출시,1
종합 인테리어 시장 진출한 물류난에 살아나는 수익성,1
주가 훈풍 재건축 규제 완화되나,0
열효율성 뛰어난 SB스톤 마루 온돌난방 최적화,0
게시판 온라인 인테리어 플랫폼 출시,1
SB스톤 마루 질감 무늬 살리고 충격에도 튼튼,0
다이렉트 홈 인테리어 플랫폼 봄 선보여,0
IB토마토 크레딧시그널 주택경기 따라 실적 가변성 존재,0
특징주 건설 친환경 테마 쌍끌이에 거래량 천만 목전 주가,0
공간의 감각 라솔라 지구의 감각을 만나다 展 주목,1
대리석과 흡사한 질감 구현 충격에 강해,0
구리 수혜주 대한전선 대원전선 혼조세 국제 구리가격 급등여파,1
숨고르기중 다시 상승반전 우크라사태로 원자재가격 폭등,0
특징주 1분기 실적 경신 전망에 주가 올랐을까,1
특징주 우크라이나 침공 장기화 구리 가격 폭등에 강세,1
주가 9%↑ 주당 50원 현금 결산배당,1
특징주 전쟁위험 완화 구리가격 상승 관련주 관심↑,1
10% 급등에 5000원선 재돌파 공매도 수량 10주 미만,1
2970억 규모 단기 차입 결정,0
국내유일 전자급황산 특허보유기업 맥코이 에 60억 기술도입료,0
주가 꾸준한 상승세 유지 무슨 이유있나,1
특징주 곡물 비료 관련주 조정기 끝냈다 주가는,0
전 세계적 비료 가격 상승 이번 주 주가 21% 상승,0
맥코이 ㈜ 에 60억 기술도입료 무상공여 전격 선언,0
28억 규모 유형자산 매각,-1
30일 정기주주총회,0
실적점검 21 4Q 영업이익 4억원 적자지속,-1
특징주 잭팟 터진 정상 찍을까 철강株 고공행진,1
주가 급락 장시작 조정국면 들어가나,-1
스틱벤처스 후속투자 돕는 2000억대 벤처펀드 조성,1
디피씨 지분 전량 TS인베에 매각,-1
연기금에 4조 벌어줘 투자보국 국민과 성장과실 나눌 것,1
시그널 스틱 상장 후 첫 주총 앞두고 의결권 확보 총력,1
스틱인베 경영진 5인방 375억 성과급 대박 채진호 부문대표 170억 받아,1
볼빅 TS인베스트먼트 220억 투자 유치,1
카톡 선물하기 폭풍성장 스틱 IT투자 내공 빛났다,1
다이어트 숍을 플랫폼으로 스틱의 승부수,0
주가 25%↑ 러 우크라 철강 공장 피해 때문,-1
우크라 폭격에 전력난 우려까지 철강株 몸값 뛴다,-1
주가 상한가 아조브스탈 심각한 피해,-1
광주국세청 납세자의 날 기념행사 은탑산업훈장,1
특징주 문배철강 철강 수급 우려 확산에 주가 수혜받나,-1
삼일제약 하이스틸 시간외 거래 급등,1
우크라이나 사태 반사이익 철강 업계는 표정관리 중,1
카스피해 주변 4개국 물류 회랑 활성화 합의,-1
발전 800주 규모 탄소상쇄 숲 조성한다,0
발전 강원도 고성에 탄소상쇄 숲 조성,0
발전 창립 21주년 에너지전환 선도기업 향한 질주,1
발전 도전정신 상생협력 유연한 조직문화 조성,1
발전 강원도 고성에 탄소상쇄 숲 조성,0
발전 수소연료전지 발생 열 활용 농가에 온수 공급,1
창립 21주년 발전 조직문화 혁신 친환경 신사업 개척할 것,1
한국 발전 당진발전본부 청렴릴레이 캠페인,0
1일 발전공기업 소식 에너지공단 남부발전 발전,0
특징주 하림 넘어선 육계협회 대응에 주가 급등,1
육계업계 공정위 과징금 내다가 도산할 위기 왜,-1
공정위 올품 체리부로 등 5개사 고발,0
치킨값 비싸진 이유 있었네 하림 등 16곳 12년간 담합,0
치킨값 무려 2만원 시대 등 닭고기 담합 때문,0
공정위 하림 등 닭고기 가격 담합 16곳에 과징금 1758억 부과,-1
치킨 등에 쓰이는 닭고깃값 12년 담합 하림 등 과징금 1 758억,-1
하림 등 12년 간 닭고기값 담합 공정위 올품 검찰 고발,0
하림 등 육계업체 16개사 담합등 적발 5개사 검찰 고발,-1
검찰 육계 담합 혐의 업체 수사 5개사 고발,-1
㈜ 에프에스 함양군에 인재육성 장학금 500만,0
실적점검 4Q 영업이익 13억원 PER 9배,1
에프에스 함양군에 인재육성 장학금,0
㈜ 에프에스， 함양군에 장학금 500만 원 기탁,0
첫돌 아기가 100만원 기부 세종시 최연소 나눔리더 가입,0
특징주 거리두기 연장에 포장지 수요 폭증 배달음식 포장지 백판지 제,0
수급과 가치 52주 최저가 경신 PER 9 5배,-1
겨울이 가져다 준 시간의 마술,0
작년 영업이익 132억원 전년比 36 9% 감소,-1
실적점검 3Q 영업이익 34억원 PER 10 9배,1
주식 매수의견 유지 기자재 원가 상승의 영향 적어,0
1분기 해외건설 수주 17% 감소 부진 롯데건설 선방,-1
첫 여성 사외이사 선임 ESG 위원회 신설,0
목타는 현대건설 대형 해외 플랜트 수주戰 고배,1
업앤다운 건설주 상승 ↑ 화성산업↓,-1
첫 여성 사외이사 선임 ESG 위원회 신설,0
멕시코 도스보카스 정유플랜트 사업 순항,0
직원 평균 연봉 1억6200만원 삼성전자보다 더 많이 받는 회사는,0
박만규 최정욱 대표이사 사장 체제 변경,0
박만규 최정욱 투 톱 전환,0
20년 이끈 최재우 대표이사 부회장으로 승진,0
191억 규모 당진지역 전력구공사 수주,1
유가증권시장 공시 기아 일신석재,0
특징주 지난해 순익 증가에 현금배당 확대 4%↑,1
461억원 규모 울산신항 남방파제 기초처리공사 수주,1
작년 연간 연결 영업익 40억 전년비 26 3%↑,1
코스피 만도 SK아이이테크놀로지 현대해상 SKC 사모기관 순매수,0
동영해운 인천 베트남 잇는 신규 컨 항로 서비스 개설,0
김홍국 회장 사내이사 재선임,0
지난해 평균연봉 1억원 넘은 대기업 21곳 2년 전 대비 2 6배,0
턴어라운드 명가 JKL 살려 투자금 3배 수익,1
정관 개정 싱가포르 상장폐지 매듭,1
外人 태도 주목 속 HMM 대한해운 장중 주가 하락,-1
에이치라인 SK해운 카타르발 대우조선 건조 LNG선 선주사 선정,1
동남아항로 중국 약세에도 한국발 운임은 견고,-1
9년만에 베트남 하이퐁 사선항로 출범,0
제49회 상공의 날 금탑산업훈장 에 삼성SDI 천보 TF사진관,1
최윤호 삼성SDI 대표 고석태 회장 상공의 날 금탑산업훈장 수훈,1
최윤호 삼성SDI 사장 고석태 회장 이상율 천보 대표 금탑산업훈장,1
전 관세청 서기관 주 넷 본부장 취업 가능,0
모터스 카니발 하이리무진 기반 노블클라쎄 L4 2세대 출시,1
특징주 헬륨 유통 사업 가치 부각 강세,1
넷 알포터 업무협약 통해 글로벌 물류 플랫폼 구축,1
묻지마 희망퇴직 논란,-1
신뢰 잃은 노조 측 3D프린트 사업 축소에 항의전화 이어져,-1
단독 임원 해임 구조조정 3D프린터 사업 축소 기습 강행,-1
사무용 복합기 넘어 글로벌 3D 프린터 기업 발돋움,0
6회 연속 소비자중심경영 인증 달성,1
애니메디솔루션과 3D 프린터 협업으로 스마트 헬스케어 솔루션,1
2021년 영업익 43억 원 흑자전환,1
실적발표 한국바이오젠 오스템임플란트 GS글로벌,-1
새 대표이사에 박동안 부사장 선임,0
떠나자 카드사용 증가율 1위는 숙박시설,1
묻지도 따지지도 않는 신용카드 올해 역시 인기,1
BIZ iD BENEFIT카드 유튜브 영상 100만뷰 돌파,1
게시판 자녀교육비 혜택 삼성 iD EDU 카드 출시,1
이주의 카드 신한카드,0
모르면 킹받는 사업자 카드 유튜브 14일 만에 100만뷰↑,1
카드사 CEO연임 여성 사외이사 주총 마무리 신사업 확대 눈길,1
롯데월드카드 혜택 업그레이드 현장 할인에 이벤트까지,0
Daily Pick 금융 현대캐피탈 교보생명 NH농협생명 동양생명,0
김대환 카드 연봉킹 등극 직원 평균 인상률의 3배 챙겨,0
올해 실적도 맑음 목표주가 3 4만,0
윤석열 파워 엘리트 263人 이도훈 前 본부장 당선인 비서실 특별,0
이노션 다음 격전지는 가상현실,0
尹당선인 취임식 기획사 LG 계열 HS애드 DJ 盧 취임식 맡았던 곳,0
단독 NFT사업 본격 진출,1
삼성證 1분기 실적 예상치 상회 전망 목표주가 3만원,0
주총 유정근 사장 디지털 경쟁력 위한 인수합병 추진,1
공군 훈련기 편대임무 계기비행 충돌 원인 정밀 조사 중,-1
프로야구 개막 5개 구장 약 6만7000명 야구팬 함께 했다,0
레데키 혼신의 역영,0
존경받지 못하는 140년 역사 이젠 공동체 포용할 때 엔지 KT&G,0
카드로 정리한 10개 구단 전력 투타 꽃놀이패 KT 우승후보 0순위,0
시즌 개막 앞두고 KT 위즈 강백호 발가락 부상,0
Seezn 시즌 영국드라마 맥파이 살인사건 독점공개 4월1일 전편공개,0
KT 주총서 SEC 과징금 에 공식 사과 박종욱 대표 이사 자진 사퇴,-1
14일 공시 자사주 매입 효성오앤비,0
대형 증권사 부럽지 않은 강소 증권사,0
잡인사이드 공채 속보 신입 채용,0
6월 2일 일 까지 2019년도 하반기 신입사원 공개채용,0
11월 8일 목 17시까지 신입사원 공개채용,0
최영진 감사위원 중도퇴임,0
IR개최,0
공시 애경유화 外,0
최대주주 자사주 0 05% 매수,0
코스피 3 000 탈환 쉽지 않다 증권가 올해 지수 전망 줄하향,-1
머니텐TV 스튜디오 오픈기념 라이브 투자방송,1
유튜브 채널 머니텐TV서 구독자와 소통,0
4월 코스피 충분한 투자 매력 최대 2940선까지도,1
BIS Summit 2022 반부패 서약,0
금감원 헤지펀드 증권사 검사 외국계證 공매도 점검,0
지어소프트 오아시스마켓 성장으로 기업가치 증대,1
POSCO홀딩스 급격한 금리 인상 반영에 목표가↓ 교보,-1
4월 코스피 2 600∼2 800 전망 3 000때와 환경 달라,0
박봉권 사장 연임 확정 주당 500원 배당 결정,1
특징주 수산물 대장주 전쟁 악화 우려에 관심↑ 주가는,-1
수산 수혜주 사조씨푸드 CJ씨푸드 일제 상승 수산식품 수출 전,1
주가 16%↑ 수산물 가격 급등 소식 영향,1
주가 상한가 수산물 수출 차질 빚나,1
특징주 수산물 대장주 가렸다 사조 CJ 제치고 홀로 주가↑,1
러 수산물 수출 빨간불 8%대 상승세,-1
주가 29 81% 급등 우크라 전쟁 여파 수산물 공급 차질,1
코스피 코스닥 혼조 출발 화성산업 내츄럴엔도텍 급등,1
자금마련 비상 유상증자 내달로 연기,0
주가 16%↑ 최대주주 변경 소식 덕분,1
특징주 너무 올랐었나 유증 결정 속 급락,-1
숨고르기중 주가 꿈틀 외국인과 기관 매도우위는 부담,0
주가 5%↑ 최대주주 변경 소식에 상승세,1
친환경 브랜드 자주웰니스 선보인다,0
립스틱 재활용한 크레용 아동기관에 전달,0
여성복 데님 매출 205%↑,1
브리핑 삼성물산 패션 KGC인삼공사,0
향수를 뛰어넘어 딥티크만의 특별한 순간에 매혹당하다,0
신세계그룹 18개 계열사 상반기 최대 쇼핑 축제 연다,0
코스피 S Oil LG이노텍 SK하이닉스 호텔신라 신세계인터 은행 순매수 상,0
비싼 향기 에 빠진 향수 애호가들 유통업계는 향수앓이 중,0
봄맞이 아트 마케팅 본격화,0
신세계그룹 2022 랜더스데이 개막 계열사별 프로모션은,0
노브랜드 버거 크런치윙 무료 증정 프로모션 실시,0
예능형 라방으로 재미 선사 브랜드 콜라보까지,0
사업 구조변화 중장기 성장 가능성 하이,1
야구 팬 위한 랜더스 스낵 출시,1
신세계인터내셔날 친환경 브랜드 자주웰니스 선보인다,0
라이브 방송 누적 뷰 1000만회 돌파,1
신세계 맥주 잘 될까 주류업계 심드렁한 이유 박종관의 食코노미,0
신세계 고교야구에 시원하게 쐈다 처음으로 상금 지급,0
GS건설 연어 나온다 국내 연어 양식 어떻게,0
신세계그룹 18개 계열사 상반기 최대 쇼핑 축제 연다,0
클라우드 인프라 사업 강화,1
5G 특화망 솔루션 기업 에어스팬 파트너십 체결,1
지난해 영업익 167억원 사상 최대치,1
해성옵틱스 각각 지난해 영업이익 167억원 매출 1408억 달성,1
지난해 매출 3 820억 원 영업이익 167억 원 기록,1
작년 연결 영업익 167억 순이익 흑전,1
최대주주 아이티센 291만주 규모 주식 매입,0
4거래일만에 2% 하락 공매도 수량 10주 미만,-1
제주4 3 미술 아카이브 기획전 후원,0
현대홈쇼핑서 북유럽 4개국 10일 패키지 판매,0
제주드림타워 안고 리오프닝 기대감,1
북유럽 10일 여행 3일 밤 현대홈쇼핑에서 첫 공개,0
슈퍼키즈홀딩스 여행상품 공동 개발 협약,1
Biz & Now 중앙일보 여행상품 MOU,0
유안타 코로나 이후 달라질 것,0
리오프닝 대비 신입 및 경력직 200명 채용,0
SK證 올해 확실한 턴어라운드 목표주가 2 5만원,0
주가 11%↑ 러시아 때문에 니켈값 상승 영향,1
숨고르기후 다시 상승발진 채비 외국인 매도공세는 부담,0
니켈 가격 역대 최고에 관련주 강세 세아특수강 급등,1
특징주 러 우크라 침공 비철금속 관련株 주가↑,1
코스피 코스닥 동반하락 출발 유에스티 티플랙스 급등,-1
주가 수직 상승 니켈 타고 훨훨,1
코스피 코스닥 장중 동반 하락 퍼스텍 티플랙스 급등,-1
2022 KBO 중계 시작,0
LGU 소비자 분석 플랫폼 데이터플러스 출시,1
LGU 우체국 전용폰 출시 알뜰폰 요금제도 확대,1
소비자 분석 플랫폼 데이터플러스 출시,1
온라인 요금제 혜택 강화 후 이용자 10배 늘었다,1
과기정통부 출신 권용현 CSO로 선임,0
수십억 빼돌린 직원 이미 한국 떠났다,0
LGU 숙대에 대학 전용 메타버스 스노우버스 국내 최초 오픈,1
KT LGU 갤S22 갤S22 지원금 최대 45만 50만원 3배로 껑충,1
도전은행 기부 도전 3만건 돌파,1
삼성그룹 사외이사 현직교수가 64 8%,0
보험사 건강관리 앱서 홈트 식단 코칭,0
보험 디지털 혁신② IT 시스템 확장하는 삼성생명 디지털 퍼스트 정조,1
보험풍향계 마케팅 스며든 이종 異種 간 결합 눈길,0
암보험금 미지급 삼성생명 과징금 중징계 1년 신사업 전망은,-1
삼성생명 암보험금 미지급 기관경고 확정 파장은,0
삼성생명 암보험금 부지급 관련 과징금 1억5500만원 등 중징계,-1
비건설 부문의 선전으로 재무 구조 다잡는 삼성물산,1
50억 조달 위한 유상증자 결정,0
KH필룩스 100억 전환사채 발행 결정,0
KH필룩스그룹이 보여준 투지가 도쿄올림픽 메달로 이어졌다,0
KH필룩스 유도단 도쿄올림픽서 은메일 동메달 획득 쾌거,0
지난해 상장법인 122개사 상호변경,1
지역기업과 청년의 희망이음 프로젝트 유공자 포상,0
국민 혈세 로 만든 알펜시아리조트 반값 7100억원에 팔렸다,0
지역 기업과 청년 잇는 희망이음 프로젝트 성과,1
삼성전기 전자장비 상장기업 브랜드평판 3월 1위 LG이노텍 뒤이어,1
브랜드평판 전자장비 상장기업 순위 1위 삼성전기 2위 LG이노텍 3위 일진머,1
실적점검 4Q 영업이익 88억원 PER 19 2배,1
호실적에 주가 급등,1
중요공시 관련 매매거래정지,0
포괄적 주식교환계약 신주 186만주 발행,0
지난해 영업익 167억 흑자전환,1
4분기 실적 예상 상회,0
특징주 김정은 위원장 말에 주가 상승폭 확대,1
주가 상한가 북한 식량난 벼랑끝,1
거듭되는 실적 내리막길 한숨,-1
조류인플루엔자 의심축 또 확인 진원생명과학 이글벳 제일바이오 노,0
부안에서 고병원성 조류인플루엔자 확진 진원생명과학 우진비앤지,0
특징주 코로나19 치사율 80% 감소 효과 이버멕틴 제품 부각에 강세,-1
IB토마토 수익성 악화 자금조달로 빚 줄이기 안간힘,1
주가 초반 급락 유상증자 172억 규모 결정 영향,-1
유상증자 172억 규모 결정 주주배정 뒤 실권주 일반공모,0
약사법 위반으로 행정처분,-1
의약품 제조정지 처분 과징금 갈음 1억 솜방망이 지적,-1
제약사의 배신 그때 그들이 주식을 팔아치운 까닭,0
제약사 1인당 매출 162배 차 광동 유한 알리코 톱3,0
급성기관지염 복합치료제 필리핀 특허,0
굴리고 모은 코로나 2년 제약업계 수익 흐름은 좋았다,1
급성기관지염 복합제 필리핀 특허 등록,0
제약업계 주총 25일 막주 집중 새 수장 맞는 곳 어디,0
상장제약사 현금성 자산 23% 급증 6개사 1000억 상회,1
제약사 임직원 연봉 차 평균 8배 셀트리온이 25배로 최고,1
코로나19로 사업보고서 지연 제출 승인,-1
27억 현금배당 실시 배당률 1 1%,1
특징주 13%대 급등 금속분리판 기술개발 영향,1
주가 조정이후 폭등랠리 2kW급 고체산화물연료전지 스택 제작 운,0
더벨 현대차 깐부 알짜배기 분리판사업 진출,1
3Q 영업손실 14억 적자지속 주가 하락,-1
대기업 임직원 남녀 임금 격차 1 43배 女 임금 높은 업종은 종합,0
실적점검 3Q 영업이익 14억원 PER 16 8배,1
KT&G 상상마당 부산 2022 코코챌린지 공모,0
KT&G 주총 백복인 지속 성장 미래 투자 글로벌 강화,1
이랜텍 와 전자담배 디바이스 3692억 공급계약,1
KT&G 지난해 영업이익 1조3195억원 전년比 10 4%↓,-1
주당 4800원 배당 시가배당률 5 7%,1
농식품부 제35호 A 벤처스 주 지플러스생명과학 선정,1
단독 정관장 KGC인삼공사 수장 교체 허철호 전무 선임,0
저도소주 시장 개척한 100년 기업 고객 개발참여 뉴 좋은데이 출시,1
경남소식 농협 농기계 순회수리 봉사 발대식 열어,-1
마산 여중 바리스타 웹툰 교실 열어,0
경남농협 아름다운 동행 첫걸음,0
탈진 독수리 건강회복 자연으로,1
강사의 서재 일반인들의 경제 활동에 빠짐없이 등장하는 것이 세금 문제다,-1
마산 여중고 설립자 서천수 씨 별세,0
농촌사회공헌 인증기관 선정,1
창원 마산합포구 문화동， 로 변 법면 환경정비,0
농촌사회공헌 인증기관 선정,1
두산에너빌리티 로 새출발 21년만의 사명변경,0
원전 얘기 왜 안 나오지 급등하던 보름만에 14% 하락,-1
중공업이 사라진다 새 옷 갈아입는 기업들,0
외인 기관 팔자에 주가 하락,-1
두산에너빌리티로 새출발 재도약의 원년 삼겠다,1
등 내달 의무보유 해제 물량 가장 많은 기업은,0
1분기 리그테이블 유증주관 빅딜 잡은 KB證 1위,1
두산에너빌리티 로 새출발,0
원자력 발전 기대감에도 주가 하락 왜,-1
34살 프로듀서 안타까운 선택 SBS 스튜디오S 공동조사 응하라,-1
화려해진 개표 방송 메타버스 유튜브로 볼거리 진화,0
스튜디오S 프로듀서 사망 사건 노사 공동조사 실시한다,-1
음악방송 순위집계에 필수가 된 소셜미디어 점수,0
하바나의원 클리닉 탤런트극회 공식지정병원으로 업무협약조인식,1
SBS 피디 경질 후폭풍 이게 무슨 공정방송 블랙코미디,0
SBS 피디 선거개입 하차 논란 언론자유 침해 비화 조짐,-1
보험금 노린 가평계곡 남편 살인사건 용의자 2명 공개수배,0
삼성증권 조선비즈 문화방송 등 신입∙경력 모집,0
LG 1천만대 삼성 125만대 전망 양사 올레드 동맹 성사될까,0
1분기 경영실적 관련 27일 기업설명회,0
영상 OELD 증설 삼성은 고심중,1
영상 TV용 디스플레이 세계 1위 탈환,1
2021 법인세 분석 OLED 호황 3853억원 4년새 최대치,0
1년 만에 中 제치고 세계 1위 탈환,1
삼성에 OLED 공급할 수도,1
삼성 LG 동맹 임박 OLED 탑재 삼성TV 나오나,0
삼성 LG 빅딜 임박 협상 진행중,0
이노텍 화학 첫 여성 사외이사 선임,0
빌리브 디 에이블 청약접수 예고,0
이 짓는 빌리브 디 에이블 31일 견본주택 오픈,1
작년 384억 영업익 전년比 86% 증가,1
주거브랜드 빌리브 VILLIV 마포에 새 소형주택 선보인다,0
